{
  "project_id": "ex-phase6-zoom",
  "schema_version": "0.1",
  "title": "Zoom into Open tasks card",
  "width": 1080,
  "height": 1920,
  "fps": 30,
  "duration_ms": 2800,
  "assets": [
    {
      "asset_id": "ui-console",
      "kind": "image",
      "uri": "asset://examples/ui-console.png",
      "source": "studio",
      "source_type": "derived",
      "verified": true,
      "captured_at": "2026-08-29T16:50:00+07:00",
      "truth_level": "VERIFIED_PRODUCT",
      "label": "Synthetic ops console fixture"
    }
  ],
  "scenes": [
    {
      "scene_id": "s1",
      "start_ms": 0,
      "duration_ms": 2800,
      "label": "zoom card",
      "layers": [
        {
          "layer_id": "l-ui",
          "asset_id": "ui-console",
          "z_index": 0,
          "band": "TRUTH",
          "visibility": { "from_ms": 0 },
          "transform": { "x": 0.0, "y": 0.0, "w": 1.0, "h": 1.0, "opacity": 1.0 },
          "primitives": [
            {
              "type": "crop_9_16",
              "start_ms": 0,
              "duration_ms": 2800,
              "easing": "linear",
              "target": { "x": 0.0, "y": 0.0, "w": 1.0, "h": 1.0 }
            },
            { "type": "hold", "start_ms": 0, "duration_ms": 2800, "easing": "linear" },
            {
              "type": "zoom_to_region",
              "start_ms": 600,
              "duration_ms": 900,
              "easing": "ease_out",
              "target": { "x": 0.04, "y": 0.14, "w": 0.46, "h": 0.24 }
            }
          ]
        },
        {
          "layer_id": "l-text",
          "asset_id": "ui-console",
          "z_index": 10,
          "band": "TRUTH",
          "visibility": { "from_ms": 1600, "to_ms": 2800 },
          "transform": { "x": 0.0, "y": 0.0, "w": 1.0, "h": 1.0 },
          "primitives": [
            {
              "type": "kinetic_text",
              "start_ms": 1600,
              "duration_ms": 1200,
              "easing": "linear",
              "target": { "x": 0.10, "y": 0.82, "w": 0.80, "h": 0.08 },
              "params": { "text": "Focus 128", "font_size": 48, "fade_ms": 200 }
            }
          ]
        }
      ],
      "cues": []
    }
  ],
  "audio": { "mode": "MUSIC_SFX", "tracks": [] },
  "output": { "container": "mp4", "video_codec": "h264", "audio_codec": "aac" }
}
