{
  "project_id": "ex-phase8-zoom-pan",
  "schema_version": "0.1",
  "title": "Zoom Region A then pan to Region B",
  "width": 1080,
  "height": 1920,
  "fps": 30,
  "duration_ms": 3000,
  "assets": [
    {
      "asset_id": "ui-console",
      "kind": "image",
      "uri": "asset://examples/ui-console.png",
      "source": "studio",
      "source_type": "derived",
      "verified": true,
      "captured_at": "2026-08-29T18:18:00+07:00",
      "truth_level": "VERIFIED_PRODUCT",
      "label": "Synthetic ops console fixture"
    }
  ],
  "scenes": [
    {
      "scene_id": "s1",
      "start_ms": 0,
      "duration_ms": 3000,
      "label": "zoom then pan",
      "layers": [
        {
          "layer_id": "l-ui",
          "asset_id": "ui-console",
          "z_index": 0,
          "band": "TRUTH",
          "visibility": { "from_ms": 0 },
          "transform": { "x": 0.0, "y": 0.0, "w": 1.0, "h": 1.0, "opacity": 1.0 },
          "primitives": [
            {
              "type": "crop_9_16",
              "start_ms": 0,
              "duration_ms": 3000,
              "easing": "linear",
              "target": { "x": 0.02, "y": 0.14, "w": 0.48, "h": 0.28 }
            },
            { "type": "hold", "start_ms": 0, "duration_ms": 3000, "easing": "linear" },
            {
              "type": "zoom_to_region",
              "start_ms": 600,
              "duration_ms": 900,
              "easing": "ease_out",
              "target": { "x": 0.04, "y": 0.16, "w": 0.36, "h": 0.20 },
              "params": { "from": { "x": 0.02, "y": 0.14, "w": 0.48, "h": 0.28 } }
            },
            {
              "type": "pan_to_region",
              "start_ms": 1500,
              "duration_ms": 800,
              "easing": "ease_out",
              "target": { "x": 0.54, "y": 0.16, "w": 0.36, "h": 0.20 },
              "params": { "from": { "x": 0.04, "y": 0.16, "w": 0.36, "h": 0.20 } }
            }
          ]
        }
      ],
      "cues": []
    }
  ],
  "audio": { "mode": "MUSIC_SFX", "tracks": [] },
  "output": { "container": "mp4", "video_codec": "h264", "audio_codec": "aac" }
}
